{
  "run_id": "H3-run-001",
  "concern_id": "H3",
  "evaluation_target": {
    "id": "T1",
    "statement": "Prevent unintended braking.",
    "source": [
      "hazard",
      "requirements"
    ],
    "rationale": "The hazard describes the hazardous event as the vehicle suddenly stopping without an obstacle in front, and SG-3 states that the system shall prevent unintended braking."
  },
  "phenomenon_of_interest": {
    "id": "P1",
    "statement": "Vehicle braking behavior in the described straight-ahead urban driving situation, including whether braking occurs and whether it is intended or unintended.",
    "scope": "Straight ahead drive on a less frequented urban road with 50 km/h, without visible obstacles or vehicles in front of the ego vehicle, in good weather conditions.",
    "source": [
      "hazard",
      "requirements"
    ],
    "rationale": "Evaluating prevention of unintended braking requires characterising braking behaviour within the operational situation in which the hazard is defined."
  },
  "distinctions": [
    {
      "id": "D1",
      "dimension": "Braking outcome",
      "contrast_a": "The vehicle brakes as intended to avoid an obstacle or other justified collision-avoidance situation.",
      "contrast_b": "The vehicle brakes unexpectedly / unintentionally when no obstacle is in front of the vehicle.",
      "source": [
        "hazard",
        "requirements"
      ],
      "rationale": "The hazard explicitly contrasts a sudden stop without an obstacle against normal braking to avoid collisions, and collapsing these would lose the ability to determine whether the safety goal is violated."
    }
  ],
  "orrs": [
    {
      "id": "O1",
      "covers": [
        "D1"
      ],
      "obligation": "An admissible observable representation must preserve whether braking is intended or unintended in the declared operational situation.",
      "distinguishability_criterion": "The representation must make intended braking and unintended braking distinguishable as different classes of braking outcome.",
      "assumptions": []
    }
  ],
  "rr5": {
    "coverage": true,
    "consistency": true,
    "issues": []
  }
}
